{
  "artifact_id": "artifact_fdd4c92b00e9c788b87d",
  "run_id": "wf_d4b5afdd-aca5-4663-b263-da0520994fe8",
  "stage": "distiller",
  "version": 1,
  "producer": "fixture_adapter",
  "created_at": "2026-09-15T09:53:53.045Z",
  "inputs": [
    {
      "stage": "reconciler",
      "artifact_id": "artifact_6c20821c61f11f184fa6",
      "sha256": "81c622134bab783403ac9d60c650323dd8fee83303c0230c12fc5c3d537cb5d3"
    }
  ],
  "data": {
    "distillations": [
      {
        "id": "distillation_theme_4cf7458a466bdfba",
        "theme_id": "theme_4cf7458a466bdfba",
        "supporting_claim_ids": [
          "claim_4172931347899d80"
        ],
        "text": "直播开场应先说明本场主题，再考虑销售；此结论尚需实测。",
        "status": "provisional"
      }
    ]
  }
}