{
  "artifact_id": "artifact_0b39c3d090f2389d0b5b",
  "run_id": "wf_d4b5afdd-aca5-4663-b263-da0520994fe8",
  "stage": "intake",
  "version": 1,
  "producer": "external_annotations",
  "created_at": "2026-09-15T09:53:53.007Z",
  "inputs": [],
  "data": {
    "raw_id": "raw_82192282f5968b58",
    "sha256": "82192282f5968b588f6ab7e179729176bcf5d045b3ed9a6703e15bcc6382e4ad",
    "bytes": 172
  }
}