{
  "artifact_id": "artifact_65802b76e06111fc014c",
  "run_id": "wf_d4b5afdd-aca5-4663-b263-da0520994fe8",
  "stage": "router",
  "version": 1,
  "producer": "fixture_adapter",
  "created_at": "2026-09-15T09:53:53.014Z",
  "inputs": [
    {
      "stage": "intake",
      "artifact_id": "artifact_0b39c3d090f2389d0b5b",
      "sha256": "78e99d298c289bc877da23a48962cadc2a4881205b80a2cf6ca85c10608bfdca"
    }
  ],
  "data": {
    "assets": [
      {
        "id": "asset_e6504ab33cb5fd50",
        "raw_id": "raw_82192282f5968b58",
        "type": "knowledge",
        "anchor": {
          "start": 0,
          "end": 19,
          "quote": "直播前五分钟先讲清楚主题，不要急着卖。",
          "offset_unit": "UTF-16"
        },
        "parent_tag": "直播",
        "child_tag": "开场",
        "status": "provisional"
      },
      {
        "id": "asset_5085194ba68f10d5",
        "raw_id": "raw_82192282f5968b58",
        "type": "todo",
        "anchor": {
          "start": 19,
          "end": 32,
          "quote": "下周直播测试“价值转译”。",
          "offset_unit": "UTF-16"
        },
        "parent_tag": "直播",
        "child_tag": "实验",
        "status": "provisional"
      },
      {
        "id": "asset_f4a71bda00014047",
        "raw_id": "raw_82192282f5968b58",
        "type": "idea",
        "anchor": {
          "start": 26,
          "end": 30,
          "quote": "价值转译",
          "offset_unit": "UTF-16"
        },
        "parent_tag": "直播",
        "child_tag": "概念",
        "status": "provisional"
      },
      {
        "id": "asset_599aca5c5af37b24",
        "raw_id": "raw_82192282f5968b58",
        "type": "copy",
        "anchor": {
          "start": 32,
          "end": 57,
          "quote": "这句话可以做开场文案：先让用户知道今天能得到什么。",
          "offset_unit": "UTF-16"
        },
        "parent_tag": "直播",
        "child_tag": "开场文案",
        "status": "provisional"
      }
    ],
    "risk_flags": []
  }
}