{
  "artifact_id": "artifact_1cb4f788efa337ffb1bc",
  "run_id": "wf_d4b5afdd-aca5-4663-b263-da0520994fe8",
  "stage": "proposal",
  "version": 1,
  "producer": "fixture_adapter",
  "created_at": "2026-09-15T09:53:53.050Z",
  "inputs": [
    {
      "stage": "distiller",
      "artifact_id": "artifact_fdd4c92b00e9c788b87d",
      "sha256": "8a085cd566d8d549b1aaeb687023f15523c1266c7ebee470fc89aebd7f070143"
    }
  ],
  "data": {
    "proposals": [
      {
        "id": "proposal_d73a3a07dd80e96f",
        "target": "canonical_knowledge",
        "text": "直播开场应先说明本场主题，再考虑销售；此结论尚需实测。",
        "supporting_claim_ids": [
          "claim_4172931347899d80"
        ],
        "status": "pending_human_review",
        "conflict_claim_ids": []
      }
    ]
  }
}