{
  "artifact_id": "artifact_6c20821c61f11f184fa6",
  "run_id": "wf_d4b5afdd-aca5-4663-b263-da0520994fe8",
  "stage": "reconciler",
  "version": 1,
  "producer": "fixture_adapter",
  "created_at": "2026-09-15T09:53:53.040Z",
  "inputs": [
    {
      "stage": "theme_builder",
      "artifact_id": "artifact_52d2fdd46a08a03458b0",
      "sha256": "f799ead86c597c48ab49ebdd30d9fed078e40a383932d0a2326cd2c0352b5bd2"
    }
  ],
  "data": {
    "relations": [],
    "version_judgement": false
  }
}