{
  "artifact_id": "artifact_52d2fdd46a08a03458b0",
  "run_id": "wf_d4b5afdd-aca5-4663-b263-da0520994fe8",
  "stage": "theme_builder",
  "version": 1,
  "producer": "fixture_adapter",
  "created_at": "2026-09-15T09:53:53.035Z",
  "inputs": [
    {
      "stage": "family_builder",
      "artifact_id": "artifact_1682414fbefd942c1551",
      "sha256": "3c974856c06f1aaeae653c7d1ae64199a75302e3c87664e1c6da58f04bc3a9d0"
    }
  ],
  "data": {
    "themes": [
      {
        "id": "theme_4cf7458a466bdfba",
        "name": "直播开场策略",
        "central_question": "开场时应先解决什么问题？",
        "inclusion": "讨论开场阶段的任务与顺序",
        "exclusion": "不含尾场和售后策略",
        "family_ids": [
          "family_62019e5905d950b6"
        ],
        "status": "suggested"
      }
    ],
    "major_change": "none"
  }
}